### ISSUE TITLE
bind-address-ipv4 and bind-address-ipv6 affects HTTP tracker announcement behaviour in confusing ways

### ISSUE THREAD

**Issue by tearfur** [transmission/transmission#5206]
### What is the issue?

Originally discussed in https://github.com/transmission/transmission/issues/5003#issuecomment-1465090872 and https://github.com/transmission/transmission/issues/5003#issuecomment-1465111179. Credit to @likeaross https://github.com/transmission/transmission/issues/5003#issuecomment-1456178551 for raising attention to this behaviour in the first place.

This issue expands the problem scope and adds test results for more combinations of `bind-address-ipv4` and `bind-address-ipv6` than the linked comments.

#### Problem Summary

Different combinations of `bind-address-ipv4` and `bind-address-ipv6` values affect announcements to trackers in strange ways.

- Currently, in order for Transmission to announce a "started event" (`&event=started`) in a [BEP-7](https://www.bittorrent.org/beps/bep_0007.html)-esque way (i.e. announce via both IPv4 and IPv6), you have to set `"bind-address-ipv6": ""`, but this is not the default:

  https://github.com/transmission/transmission/blob/dabd29f2b289e55ad2740ec4e4b22385fef72018/libtransmission/session-settings.h#L23

  This also does not feel intuitive because `0.0.0.0` and `::` are counterparts in IPv4 and IPv6. I expected both of them to simply mean "talk to trackers with whatever IP address".

- Meanwhile, setting `"bind-address-ipv6": ""` and `"bind-address-ipv4": ""` causes Transmission to *not* announce a "stopped event" (`&event=stopped`) on exit. To my best ability, I cannot find any documentation that prohibits this setting.

#### Suggestion

Perhaps the behaviour for these 2 parameters should be something like this:

- Empty string will disable that IP protocol (maybe, 2 empty strings will cause Transmission to show an error and stop all torrents?).
- A valid IP address will enable that IP protocol (minus special IP addresses and other quirks of course).
- In any case, the stopped event (`&event=stopped`) should be announced on exit for enabled IP protocols.

Please feel free to correct me since I am not exactly good at making things user-friendly.

Or, if this is intended behaviour (although I don't understand why), then I am happy to help make a documentation PR.

#### Test results about Current Behaviour

<details>
<summary>Click to Expand</summary>

I tested 4 test cases using the [Debian 11.6.0 amd64 DVD ISO torrent](https://cdimage.debian.org/debian-cd/current/amd64/bt-dvd/debian-11.6.0-amd64-DVD-1.iso.torrent) on a Fedora 37 machine capable of both IPv4 and IPv6, no NAT involved. The official Fedora package was used to install Transmission.

| bind-address-ipv6 | bind-address-ipv4 |
| --- | --- |
| `"::"` | `"0.0.0.0"` |
| `""` | `"0.0.0.0"` |
| `""` | `""` |
| `"::"` | `""` |

The tracker announcement behaviour is observed by capturing packets towards the Debian tracker (the only tracker for this torrent):

```bash
tcpdump -nn -A dst host bttracker.debian.org
```

## `"bind-address-ipv6": "::" ` and `"bind-address-ipv4": "0.0.0.0"` (Default, announce IPv6 only)

- Transmission will only announce one "started event" via IPv6, even though both parameters are `INADDR_ANY`. Intuitively, I reckon this combination should mean that both IPv4 and IPv6 will be used in announcements.

  ```
  tcpdump: verbose output suppressed, use -v[v]... for full protocol decode
  listening on eno1, link-type EN10MB (Ethernet), snapshot length 262144 bytes
  12:29:59.285341 IP6 2a01:REDACTED.33876 > 2001:6b0:e:2018::158.6969: Flags [S], seq 2470523983, win 2880, options [mss 1440,sackOK,TS val 631331172 ecr 0,nop,wscale 0], length 0
  `....(.@*....ANJ........ ..... ........X.T.9.A4O.......@...........
  %.Yd........
  12:29:59.321447 IP6 2a01:REDACTED.33876 > 2001:6b0:e:2018::158.6969: Flags [.], ack 2714962884, win 2880, options [nop,nop,TS val 631331208 ecr 3879232492], length 0
  `.... .@*....ANJ........ ..... ........X.T.9.A4P.......@.......
  %.Y..8c.
  12:29:59.321652 IP6 2a01:REDACTED.33876 > 2001:6b0:e:2018::158.6969: Flags [P.], seq 0:343, ack 1, win 2880, options [nop,nop,TS val 631331208 ecr 3879232492], length 343
  `....w.@*....ANJ........ ..... ........X.T.9.A4P.......@.2.....
  %.Y..8c.GET /announce?info_hash=%07c%B7W4%19V%B9%BFY%94%E4%A9%92%C3do%9F%19%BD&peer_id=-TR4010-kclow8z4010n&port=51413&uploaded=0&downloaded=0&left=3909091328&numwant=80&key=3865989059&compact=1&supportcrypto=1&event=started HTTP/1.1
  Host: bttracker.debian.org:6969
  User-Agent: Transmission/4.0.1
  Accept: */*
  Accept-Encoding: deflate, gzip, br
  
  
  12:29:59.357774 IP6 2a01:REDACTED.33876 > 2001:6b0:e:2018::158.6969: Flags [.], ack 802, win 2403, options [nop,nop,TS val 631331244 ecr 3879232549], length 0
  `.... .@*....ANJ........ ..... ........X.T.9.A5.......  c.......
  %.Y..8d%
  12:29:59.398703 IP6 2a01:REDACTED.33876 > 2001:6b0:e:2018::158.6969: Flags [.], ack 803, win 2403, options [nop,nop,TS val 631331285 ecr 3879232549], length 0
  `.... .@*....ANJ........ ..... ........X.T.9.A5.......  c.......
  %.Y..8d%
  12:29:59.938964 IP6 2a01:REDACTED.33876 > 2001:6b0:e:2018::158.6969: Flags [F.], seq 343, ack 803, win 2403, options [nop,nop,TS val 631331825 ecr 3879232549], length 0
  `.... .@*....ANJ........ ..... ........X.T.9.A5.......  c.......
  %.[..8d%
  ^C
  6 packets captured
  26 packets received by filter
  0 packets dropped by kernel
  ```

- It will also announce a "stopped event" to IPv6 on exit.

  ```
  tcpdump: verbose output suppressed, use -v[v]... for full protocol decode
  listening on eno1, link-type EN10MB (Ethernet), snapshot length 262144 bytes
  17:35:11.176179 IP6 2a01:REDACTED.36644 > 2001:6b0:e:2018::158.6969: Flags [S], seq 611106442, win 2880, options [mss 1440,sackOK,TS val 649643063 ecr 0,nop,wscale 0], length 0
  `..".(.@*....ANJ........ ..... ........X.$.9$l.........@...........
  &..7........
  17:35:11.212312 IP6 2a01:REDACTED.36644 > 2001:6b0:e:2018::158.6969: Flags [.], ack 4001826601, win 2880, options [nop,nop,TS val 649643099 ecr 3897544364], length 0
  `..". .@*....ANJ........ ..... ........X.$.9$l.....)...@.......
  &..[.O..
  17:35:11.275321 IP6 2a01:REDACTED.36644 > 2001:6b0:e:2018::158.6969: Flags [P.], seq 0:349, ack 1, win 2880, options [nop,nop,TS val 649643162 ecr 3897544364], length 349
  `..".}.@*....ANJ........ ..... ........X.$.9$l.....)...@.8.....
  &....O..GET /announce?info_hash=%07c%B7W4%19V%B9%BFY%94%E4%A9%92%C3do%9F%19%BD&peer_id=-TR4010-r7q369imeu6c&port=51413&uploaded=0&downloaded=96206848&left=1827815424&numwant=0&key=3508765978&compact=1&supportcrypto=1&event=stopped HTTP/1.1
  Host: bttracker.debian.org:6969
  User-Agent: Transmission/4.0.1
  Accept: */*
  Accept-Encoding: deflate, gzip, br
  
  
  17:35:11.310574 IP6 2a01:REDACTED.36644 > 2001:6b0:e:2018::158.6969: Flags [.], ack 137, win 2744, options [nop,nop,TS val 649643197 ecr 3897544503], length 0
  `..". .@*....ANJ........ ..... ........X.$.9$l........
  ........
  &....O.7
  17:35:11.310667 IP6 2a01:REDACTED.36644 > 2001:6b0:e:2018::158.6969: Flags [F.], seq 349, ack 138, win 2744, options [nop,nop,TS val 649643197 ecr 3897544503], length 0
  `..". .@*....ANJ........ ..... ........X.$.9$l........
  ........
  &....O.7
  ^C
  5 packets captured
  60 packets received by filter
  0 packets dropped by kernel
  ```

## `"bind-address-ipv6": "" ` and `"bind-address-ipv4": "0.0.0.0"` (BEP-7-esque)

- One "started event" announcement each via IPv4 and IPv6.

  ```
  tcpdump: verbose output suppressed, use -v[v]... for full protocol decode
  listening on eno1, link-type EN10MB (Ethernet), snapshot length 262144 bytes
  15:23:19.871024 IP REDACTED.39264 > 130.239.18.158.6969: Flags [S], seq 2622765832, win 2920, options [mss 1460,sackOK,TS val 1347351646 ecr 0,nop,wscale 0], length 0
  E..<..@.@.@.t........`.9.T;........h.;.........
  PN.^........
  15:23:19.871420 IP6 2a01:REDACTED > 2001:6b0:e:2018::158.6969: Flags [S], seq 2705395785, win 2880, options [mss 1440,sackOK,TS val 641731758 ecr 0,nop,wscale 0], length 0
  `.5..(.@*....ANJ........ ..... ........X...9.A.I.......@...........
  &@..........
  15:23:19.906317 IP REDACTED.39264 > 130.239.18.158.6969: Flags [.], ack 3768636573, win 2920, options [nop,nop,TS val 1347351681 ecr 3844689501], length 0
  E..4..@.@.@.t........`.9.T;     .......h.3.....
  PN...)N]
  15:23:19.906451 IP REDACTED.39264 > 130.239.18.158.6969: Flags [P.], seq 0:343, ack 1, win 2920, options [nop,nop,TS val 1347351681 ecr 3844689501], length 343
  E.....@.@.?.t........`.9.T;     .......h.......
  PN...)N]GET /announce?info_hash=%07c%B7W4%19V%B9%BFY%94%E4%A9%92%C3do%9F%19%BD&peer_id=-TR4010-1tzehyvdairn&port=51413&uploaded=0&downloaded=0&left=3909091328&numwant=80&key=3899210886&compact=1&supportcrypto=1&event=started HTTP/1.1
  Host: bttracker.debian.org:6969
  User-Agent: Transmission/4.0.1
  Accept: */*
  Accept-Encoding: deflate, gzip, br
  
  
  15:23:19.906575 IP6 2a01:REDACTED > 2001:6b0:e:2018::158.6969: Flags [.], ack 3470517762, win 2880, options [nop,nop,TS val 641731793 ecr 3889633068], length 0
  `.5.. .@*....ANJ........ ..... ........X...9.A.J.......@.......
  &@.....,
  15:23:19.906681 IP6 2a01:REDACTED > 2001:6b0:e:2018::158.6969: Flags [P.], seq 0:343, ack 1, win 2880, options [nop,nop,TS val 641731793 ecr 3889633068], length 343
  `.5..w.@*....ANJ........ ..... ........X...9.A.J.......@.2.....
  &@.....,GET /announce?info_hash=%07c%B7W4%19V%B9%BFY%94%E4%A9%92%C3do%9F%19%BD&peer_id=-TR4010-1tzehyvdairn&port=51413&uploaded=0&downloaded=0&left=3909091328&numwant=80&key=3899210886&compact=1&supportcrypto=1&event=started HTTP/1.1
  Host: bttracker.debian.org:6969
  User-Agent: Transmission/4.0.1
  Accept: */*
  Accept-Encoding: deflate, gzip, br
  
  
  15:23:19.941825 IP6 2a01:REDACTED > 2001:6b0:e:2018::158.6969: Flags [.], ack 838, win 2511, options [nop,nop,TS val 641731828 ecr 3889633134], length 0
  `.5.. .@*....ANJ........ ..... ........X...9.A.....G..  ........
  &@.....n
  15:23:19.941839 IP REDACTED.39264 > 130.239.18.158.6969: Flags [.], ack 620, win 2476, options [nop,nop,TS val 1347351716 ecr 3844689567], length 0
  E..4..@.@.@.t........`.9.T<`......      ..3.....
  PN...)N.
  15:23:19.941964 IP REDACTED.39264 > 130.239.18.158.6969: Flags [F.], seq 343, ack 621, win 2476, options [nop,nop,TS val 1347351716 ecr 3844689567], length 0
  E..4..@.@.@.t........`.9.T<`... ..      ..3.....
  PN...)N.
  15:23:19.942024 IP6 2a01:REDACTED > 2001:6b0:e:2018::158.6969: Flags [F.], seq 343, ack 839, win 2511, options [nop,nop,TS val 641731829 ecr 3889633134], length 0
  `.5.. .@*....ANJ........ ..... ........X...9.A.....H..  ........
  &@.....n
  ^C
  10 packets captured
  12 packets received by filter
  0 packets dropped by kernel
  ```

- It will also announce one "stopped event" each to both IPv4 and IPv6 on exit.

  ```
  tcpdump: verbose output suppressed, use -v[v]... for full protocol decode
  listening on eno1, link-type EN10MB (Ethernet), snapshot length 262144 bytes
  17:14:52.526815 IP REDACTED.46082 > 130.239.18.158.6969: Flags [S], seq 2040940731, win 2920, options [mss 1460,sackOK,TS val 1354044301 ecr 0,nop,wscale 0], length 0
  E..<..@.@.K.t..........9y.H........h.;.........
  P...........
  17:14:52.527182 IP6 2a01:REDACTED.48478 > 2001:6b0:e:2018::158.6969: Flags [S], seq 1245292866, win 2880, options [mss 1440,sackOK,TS val 648424414 ecr 0,nop,wscale 0], length 0
  `.(..(.@*....ANJ........ ..... ........X.^.9J9.B.......@...........
  &.+.........
  17:14:52.562642 IP REDACTED.46082 > 130.239.18.158.6969: Flags [.], ack 1773809943, win 2920, options [nop,nop,TS val 1354044337 ecr 3851382173], length 0
  E..4..@.@.K.t..........9y.H.i.1....h.3.....
  P.....m.
  17:14:52.562678 IP6 2a01:REDACTED.48478 > 2001:6b0:e:2018::158.6969: Flags [.], ack 1861179805, win 2880, options [nop,nop,TS val 648424449 ecr 3896325740], length 0
  `.(.. .@*....ANJ........ ..... ........X.^.9J9.Cn.Y....@.......
  &.,..=6l
  17:14:52.562749 IP REDACTED.46082 > 130.239.18.158.6969: Flags [P.], seq 0:350, ack 1, win 2920, options [nop,nop,TS val 1354044337 ecr 3851382173], length 350
  E.....@.@.JPt..........9y.H.i.1....h.......
  P.....m.GET /announce?info_hash=%07c%B7W4%19V%B9%BFY%94%E4%A9%92%C3do%9F%19%BD&peer_id=-TR4010-oee1d31exinm&port=51413&uploaded=0&downloaded=183762944&left=2176450560&numwant=0&key=2558308270&compact=1&supportcrypto=1&event=stopped HTTP/1.1
  Host: bttracker.debian.org:6969
  User-Agent: Transmission/4.0.1
  Accept: */*
  Accept-Encoding: deflate, gzip, br
  
  
  17:14:52.562811 IP6 2a01:REDACTED.48478 > 2001:6b0:e:2018::158.6969: Flags [P.], seq 0:350, ack 1, win 2880, options [nop,nop,TS val 648424449 ecr 3896325740], length 350
  `.(..~.@*....ANJ........ ..... ........X.^.9J9.Cn.Y....@.9.....
  &.,..=6lGET /announce?info_hash=%07c%B7W4%19V%B9%BFY%94%E4%A9%92%C3do%9F%19%BD&peer_id=-TR4010-oee1d31exinm&port=51413&uploaded=0&downloaded=183762944&left=2176450560&numwant=0&key=2558308270&compact=1&supportcrypto=1&event=stopped HTTP/1.1
  Host: bttracker.debian.org:6969
  User-Agent: Transmission/4.0.1
  Accept: */*
  Accept-Encoding: deflate, gzip, br
  
  
  17:14:52.598327 IP6 2a01:REDACTED.48478 > 2001:6b0:e:2018::158.6969: Flags [.], ack 137, win 2744, options [nop,nop,TS val 648424485 ecr 3896325791], length 0
  `.(.. .@*....ANJ........ ..... ........X.^.9J9..n.Z%..
  ........
  &.,%.=6.
  17:14:52.598434 IP6 2a01:REDACTED.48478 > 2001:6b0:e:2018::158.6969: Flags [F.], seq 350, ack 138, win 2744, options [nop,nop,TS val 648424485 ecr 3896325791], length 0
  `.(.. .@*....ANJ........ ..... ........X.^.9J9..n.Z&..
  ........
  &.,%.=6.
  17:14:52.598518 IP REDACTED.46082 > 130.239.18.158.6969: Flags [.], ack 137, win 2784, options [nop,nop,TS val 1354044373 ecr 3851382224], length 0
  E..4.   @.@.K.t..........9y.J.i.1...
  ..3.....
  P.....m.
  17:14:52.598565 IP REDACTED.46082 > 130.239.18.158.6969: Flags [F.], seq 350, ack 137, win 2784, options [nop,nop,TS val 1354044373 ecr 3851382224], length 0
  E..4.
  @.@.K.t..........9y.J.i.1...
  ..3.....
  P.....m.
  17:14:52.598573 IP REDACTED.46082 > 130.239.18.158.6969: Flags [.], ack 138, win 2783, options [nop,nop,TS val 1354044373 ecr 3851382224], length 0
  E..4..@.@.K.t..........9y.J.i.1...
  ..3.....
  P.....m.
  ^C
  11 packets captured
  289 packets received by filter
  0 packets dropped by kernel
  ```

## `"bind-address-ipv6": "" ` and `"bind-address-ipv4": ""` (BEP-7-esque but does not announce stopped event on exit)

- This combination will also announce one "started event" each for IPv4 and IPv6.

  ```
  tcpdump: verbose output suppressed, use -v[v]... for full protocol decode
  listening on eno1, link-type EN10MB (Ethernet), snapshot length 262144 bytes
  16:50:54.792964 IP REDACTED.60076 > 130.239.18.158.6969: Flags [S], seq 748229425, win 2920, options [mss 1460,sackOK,TS val 1352606567 ecr 0,nop,wscale 0], length 0
  E..<IL@.@..bt..........9,..1.......h.;.........
  P.#g........
  16:50:54.793249 IP6 2a01:REDACTED.59810 > 2001:6b0:e:2018::158.6969: Flags [S], seq 954679850, win 2880, options [mss 1440,sackOK,TS val 646986680 ecr 0,nop,wscale 0], length 0
  `.e..(.@*....ANJ........ ..... ........X...98.B*.......@...........
  &.;.........
  16:50:54.828213 IP REDACTED.60076 > 130.239.18.158.6969: Flags [.], ack 2002248177, win 2920, options [nop,nop,TS val 1352606603 ecr 3849944413], length 0
  E..4IM@.@..it..........9,..2wW.....h.3.....
  P.#..y}]
  16:50:54.828317 IP6 2a01:REDACTED.59810 > 2001:6b0:e:2018::158.6969: Flags [.], ack 3040307487, win 2880, options [nop,nop,TS val 646986715 ecr 3894887980], length 0
  `.e.. .@*....ANJ........ ..... ........X...98.B+.7i....@.......
  &.;..'F,
  16:50:54.828568 IP REDACTED.60076 > 130.239.18.158.6969: Flags [P.], seq 0:343, ack 1, win 2920, options [nop,nop,TS val 1352606603 ecr 3849944413], length 343
  E...IN@.@...t..........9,..2wW.....h.......
  P.#..y}]GET /announce?info_hash=%07c%B7W4%19V%B9%BFY%94%E4%A9%92%C3do%9F%19%BD&peer_id=-TR4010-rdcevnp4cx2k&port=51413&uploaded=0&downloaded=0&left=3909091328&numwant=80&key=1000548082&compact=1&supportcrypto=1&event=started HTTP/1.1
  Host: bttracker.debian.org:6969
  User-Agent: Transmission/4.0.1
  Accept: */*
  Accept-Encoding: deflate, gzip, br
  
  
  16:50:54.828607 IP6 2a01:REDACTED.59810 > 2001:6b0:e:2018::158.6969: Flags [P.], seq 0:343, ack 1, win 2880, options [nop,nop,TS val 646986715 ecr 3894887980], length 343
  `.e..w.@*....ANJ........ ..... ........X...98.B+.7i....@.2.....
  &.;..'F,GET /announce?info_hash=%07c%B7W4%19V%B9%BFY%94%E4%A9%92%C3do%9F%19%BD&peer_id=-TR4010-rdcevnp4cx2k&port=51413&uploaded=0&downloaded=0&left=3909091328&numwant=80&key=1000548082&compact=1&supportcrypto=1&event=started HTTP/1.1
  Host: bttracker.debian.org:6969
  User-Agent: Transmission/4.0.1
  Accept: */*
  Accept-Encoding: deflate, gzip, br
  
  
  16:50:54.863886 IP6 2a01:REDACTED.59810 > 2001:6b0:e:2018::158.6969: Flags [.], ack 898, win 2691, options [nop,nop,TS val 646986750 ecr 3894888056], length 0
  `.e.. .@*....ANJ........ ..... ........X...98.C..7l...
  ........
  &.;..'Fx
  16:50:54.864047 IP REDACTED.60076 > 130.239.18.158.6969: Flags [.], ack 620, win 2476, options [nop,nop,TS val 1352606639 ecr 3849944489], length 0
  E..4IO@.@..gt..........9,...wW.\..      ..3.....
  P.#..y}.
  16:50:54.904696 IP REDACTED.60076 > 130.239.18.158.6969: Flags [.], ack 621, win 2476, options [nop,nop,TS val 1352606679 ecr 3849944489], length 0
  E..4IP@.@..ft..........9,...wW.]..      ..3.....
  P.#..y}.
  16:50:54.904696 IP6 2a01:REDACTED.59810 > 2001:6b0:e:2018::158.6969: Flags [.], ack 899, win 2691, options [nop,nop,TS val 646986791 ecr 3894888056], length 0
  `.e.. .@*....ANJ........ ..... ........X...98.C..7l...
  ........
  &.<'.'Fx
  16:50:54.943562 IP REDACTED.60076 > 130.239.18.158.6969: Flags [F.], seq 343, ack 621, win 2476, options [nop,nop,TS val 1352606718 ecr 3849944489], length 0
  E..4IQ@.@..et..........9,...wW.]..      ..3.....
  P.#..y}.
  16:50:54.943603 IP6 2a01:REDACTED.59810 > 2001:6b0:e:2018::158.6969: Flags [F.], seq 343, ack 899, win 2691, options [nop,nop,TS val 646986830 ecr 3894888056], length 0
  `.e.. .@*....ANJ........ ..... ........X...98.C..7l...
  ........
  &.<N.'Fx
  ^C
  12 packets captured
  98 packets received by filter
  0 packets dropped by kernel
  ```

- But it will not announce any "stopped event" on exit.

  ```
  tcpdump: verbose output suppressed, use -v[v]... for full protocol decode
  listening on eno1, link-type EN10MB (Ethernet), snapshot length 262144 bytes
  16:52:48.738281 IP REDACTED.56912 > 130.239.18.158.6969: Flags [S], seq 2109060365, win 2920, options [mss 1460,sackOK,TS val 1352720513 ecr 0,nop,wscale 0], length 0
  E..<.g@.@..Gt........P.9}..........h.;.........
  P...........
  16:52:48.738605 IP6 2a01:REDACTED.59984 > 2001:6b0:e:2018::158.6969: Flags [S], seq 3664859351, win 2880, options [mss 1440,sackOK,TS val 647100625 ecr 0,nop,wscale 0], length 0
  `.U\.(.@*....ANJ........ ..... ........X.P.9.qP........@...........
  &...........
  16:52:48.774628 IP6 2a01:REDACTED.59984 > 2001:6b0:e:2018::158.6969: Flags [.], ack 32314358, win 2880, options [nop,nop,TS val 647100661 ecr 3895001964], length 0
  `.U\. .@*....ANJ........ ..... ........X.P.9.qP........@.......
  &....).l
  16:52:48.774670 IP REDACTED.56912 > 130.239.18.158.6969: Flags [.], ack 1031244263, win 2920, options [nop,nop,TS val 1352720549 ecr 3850058397], length 0
  E..4.h@.@..Nt........P.9}...=w.....h.3.....
  P....{:.
  16:52:48.816572 IP REDACTED.56912 > 130.239.18.158.6969: Flags [F.], seq 0, ack 1, win 2920, options [nop,nop,TS val 1352720591 ecr 3850058397], length 0
  E..4.i@.@..Mt........P.9}...=w.....h.3.....
  P....{:.
  16:52:48.816639 IP6 2a01:REDACTED.59984 > 2001:6b0:e:2018::158.6969: Flags [F.], seq 0, ack 1, win 2880, options [nop,nop,TS val 647100703 ecr 3895001964], length 0
  `.U\. .@*....ANJ........ ..... ........X.P.9.qP........@.......
  &....).l
  16:52:48.852752 IP6 2a01:REDACTED.59984 > 2001:6b0:e:2018::158.6969: Flags [R], seq 3664859353, win 0, length 0
  `.r....@*....ANJ........ ..... ........X.P.9.qP.....P.......
  16:52:48.852764 IP6 2a01:REDACTED.59984 > 2001:6b0:e:2018::158.6969: Flags [R], seq 3664859353, win 0, length 0
  `..^...@*....ANJ........ ..... ........X.P.9.qP.....P.......
  16:52:48.852892 IP REDACTED.56912 > 130.239.18.158.6969: Flags [R], seq 2109060367, win 0, length 0
  E..(..@.@.D.t........P.9}.......P.......
  16:52:48.852902 IP REDACTED.56912 > 130.239.18.158.6969: Flags [R], seq 2109060367, win 0, length 0
  E..(..@.@.D.t........P.9}.......P.......
  ^C
  10 packets captured
  20 packets received by filter
  0 packets dropped by kernel
  ```

## `"bind-address-ipv6": "::"` and `"bind-address-ipv4": ""` (Same as default behaviour)

- This combination will only announce one "started event" to IPv6.
  
  ```
  tcpdump: verbose output suppressed, use -v[v]... for full protocol decode
  listening on eno1, link-type EN10MB (Ethernet), snapshot length 262144 bytes
  17:51:21.223230 IP6 2a01:REDACTED.60862 > 2001:6b0:e:2018::158.6969: Flags [S], seq 685727115, win 2880, options [mss 1440,sackOK,TS val 650613110 ecr 0,nop,wscale 0], length 0
  `.[(.(.@*....ANJ........ ..... ........X...9(.]........@...........
  &..v........
  17:51:21.259753 IP6 2a01:REDACTED.60862 > 2001:6b0:e:2018::158.6969: Flags [.], ack 1588824573, win 2880, options [nop,nop,TS val 650613146 ecr 3898514412], length 0
  `.[(. .@*....ANJ........ ..... ........X...9(.].^......@.......
  &....^..
  17:51:21.259850 IP6 2a01:REDACTED.60862 > 2001:6b0:e:2018::158.6969: Flags [P.], seq 0:343, ack 1, win 2880, options [nop,nop,TS val 650613146 ecr 3898514412], length 343
  `.[(.w.@*....ANJ........ ..... ........X...9(.].^......@.2.....
  &....^..GET /announce?info_hash=%07c%B7W4%19V%B9%BFY%94%E4%A9%92%C3do%9F%19%BD&peer_id=-TR4010-qgmy4chch0lz&port=51413&uploaded=0&downloaded=0&left=3909091328&numwant=80&key=1605441796&compact=1&supportcrypto=1&event=started HTTP/1.1
  Host: bttracker.debian.org:6969
  User-Agent: Transmission/4.0.1
  Accept: */*
  Accept-Encoding: deflate, gzip, br
  
  
  17:51:21.296662 IP6 2a01:REDACTED.60862 > 2001:6b0:e:2018::158.6969: Flags [.], ack 922, win 2763, options [nop,nop,TS val 650613183 ecr 3898514488], length 0
  `.[(. .@*....ANJ........ ..... ........X...9(.^.^.....
  ........
  &....^.8
  17:51:21.296772 IP6 2a01:REDACTED.60862 > 2001:6b0:e:2018::158.6969: Flags [F.], seq 343, ack 923, win 2763, options [nop,nop,TS val 650613183 ecr 3898514488], length 0
  `.[(. .@*....ANJ........ ..... ........X...9(.^.^.....
  ........
  &....^.8
  ^C
  5 packets captured
  5 packets received by filter
  0 packets dropped by kernel
  ```

- It will also announce a "stopped event" via IPv6 on exit.

  ```
  tcpdump: verbose output suppressed, use -v[v]... for full protocol decode
  listening on eno1, link-type EN10MB (Ethernet), snapshot length 262144 bytes
  17:52:39.526106 IP6 2a01:REDACTED.46726 > 2001:6b0:e:2018::158.6969: Flags [S], seq 1988301671, win 2880, options [mss 1440,sackOK,TS val 650691413 ecr 0,nop,wscale 0], length 0
  `....(.@*....ANJ........ ..... ........X...9v..g.......@...........
  &..U........
  17:52:39.561243 IP6 2a01:REDACTED.46726 > 2001:6b0:e:2018::158.6969: Flags [.], ack 1975040018, win 2880, options [nop,nop,TS val 650691448 ecr 3898592748], length 0
  `.... .@*....ANJ........ ..... ........X...9v..hu......@.......
  &..x._..
  17:52:39.561335 IP6 2a01:REDACTED.46726 > 2001:6b0:e:2018::158.6969: Flags [P.], seq 0:355, ack 1, win 2880, options [nop,nop,TS val 650691448 ecr 3898592748], length 355
  `......@*....ANJ........ ..... ........X...9v..hu......@.>.....
  &..x._..GET /announce?info_hash=%07c%B7W4%19V%B9%BFY%94%E4%A9%92%C3do%9F%19%BD&peer_id=-TR4010-qgmy4chch0lz&port=51413&uploaded=128051&downloaded=1202192384&left=980074496&numwant=0&key=1605441796&compact=1&supportcrypto=1&event=stopped HTTP/1.1
  Host: bttracker.debian.org:6969
  User-Agent: Transmission/4.0.1
  Accept: */*
  Accept-Encoding: deflate, gzip, br
  
  
  17:52:39.596520 IP6 2a01:REDACTED.46726 > 2001:6b0:e:2018::158.6969: Flags [.], ack 137, win 2744, options [nop,nop,TS val 650691483 ecr 3898592789], length 0
  `.... .@*....ANJ........ ..... ........X...9v...u.....
  ........
  &...._..
  17:52:39.596598 IP6 2a01:REDACTED.46726 > 2001:6b0:e:2018::158.6969: Flags [F.], seq 355, ack 138, win 2744, options [nop,nop,TS val 650691483 ecr 3898592789], length 0
  `.... .@*....ANJ........ ..... ........X...9v...u.....
  ........
  &...._..
  ^C
  5 packets captured
  108 packets received by filter
  0 packets dropped by kernel
  ```
</details>

### Which application of Transmission?

transmission-daemon

### Which version of Transmission?

4.0.1

**Comment by ckerr** [comment]
@tearfur this is an exceptionally good bug report. Thanks for the tcpdump tests :1st_place_medal:

**Comment by tearfur** [comment]
@ckerr Do you mind if I take a jab at this issue? Please know that I am still figuring out libtransmission, and will probably ask questions repeatedly. I'll happily leave it to you if you have other plans for this.

I think I already narrowed down the BEP-7-esque part to this snippet.

https://github.com/transmission/transmission/blob/a2bece2682f50db15c02a4e8029b6579acf53b26/libtransmission/announcer-http.cc#L298-L332

**Comment by ckerr** [comment]
I would LOVE for someone to take point on ipv6 and/or address binding. Please do!!

**Comment by tearfur** [comment]
Could you give a direction about what the behaviour should be?

If the behaviour my suggested is the way to go, then is there any function I can use to check if `bind-address-ipv*` is an empty string?

**Comment by tearfur** [comment]
For now I will make a PR that does not change any behaviour. It will modifiy `tr_session.publicAddress()` to also check for `bind-address-ipv*` empty string, so that all future `4.x.x` commits can be based on that.

Then the rest I guess will have to wait for `5.0.0`, since it is a breaking change.

**Comment by ckerr** [comment]
@tearfur the real problem is there's nobody who has taken lead on this feature in the past. I've done more `libtransmission/` commits than anyone else so but don't have a good way to use / test the feature, so it's blind-leading-the-blind.

For this list I know point number four isn't a satisfying answer, but my honest priority list is:

1. Follow the BEPS at bittorrent.org
2. The changes should be code that you'd be OK with doing bug triage on.
3. Add regression tests if possible so that it doesn't re-break in the future (Not always easy with networking code, so YMMV)
4. Fulfill the needs requested in the issue tracker

**Comment by tearfur** [comment]
I don't know what I think about taking lead for future Transmission networking development just yet. Frankly speaking, I don't feel competent enough doing so at the moment.

Even just for this issue alone, I can see that in order to thoroughly ensure the IP protocol behaviour is consistent across the board, I need to learn the inner-workings of:

- DHT
- PEX/LTEP
- UDP announcements
- HTTP announcements
- (maybe more?)

I only feel confident enough to work on the HTTP announcement part right now. But I am interested to learn the other parts and bring this issue home eventually.

**Comment by tearfur** [comment]
Back to this issue, judging from `tr_session.publicAddress()` and how the other networking code are structured, it seems to me that the ability of enabling/disabling IPv4/IPv6 were not considered when Tr 4.0.0 is written. Instead, I see that the intention is to default to `INADDR_ANY` when no valid IP address was provided to `bind-address-ipv*`. Please correct me if I'm wrong.

Therefore, I'll start with a PR that aligns the HTTP announcement behaviour to the original intention. Then after that, I will try to align any other networking code that does not match the behaviour. Hopefully, all of the above code will be suitable for 4.x.x releases.

Enabling/disabling IP protocols is a nice-to-have for me personally, so it is not my top priority. I will leave it for later.
